{
    "community": "openchainmeta",
    "provider": {
        "provider_name": "chaintool",
        "provider_id": "ocm000001",
        "provider_signature": "xxxxx"
    },
    "version": "v1",
    "revision": 1,
    "introduction": "https://github.com/openchainmeta/chainmetareader/doc/chaintool/introduction.md",
    "chainmetadata": {
        "schema": "https://github.com/openchainmeta/chainmetareader/doc/chaintool/schema.md",
        "artifact": [{
                "artifact_type": "remote path",
                "path": "https://github.com/openchainmeta/chainmetareader/blob/add_chaintool_metadata/examples/chaintool_sample_100.csv",
                "fileformat": "csv",
                "signature": "e3aeb7c8f63d29fda476f7f96d9417ee"
            }
        ]
    }
}
